{
  "kind": "pwv2_execution_result",
  "schema_version": 1,
  "obligation_id": "sha256:b6d3a55981d76a1138b5dc28b8399ebc0c2538e7011aee6902b8a47065d9dd3a",
  "freshness_fingerprint": "sha256:8a81abcdac6103099eabc87c51050edff21560a1708e675530cff38a214dadb1",
  "status": "success",
  "subject": {
    "repository": "owner/project",
    "commit": "bbbbbbbbbbbbbbbbbbbbbbbbbbbbbbbbbbbbbbbb",
    "path": "implementation/cards/M02-T01.md",
    "blob": "cccccccccccccccccccccccccccccccccccccccc"
  },
  "changed_artifacts": [],
  "tests": [
    {
      "name": "contract suite",
      "status": "green",
      "evidence": "evidence/M02.md"
    }
  ],
  "evidence": [
    "evidence/M02.md"
  ],
  "readback": [
    {
      "target": "Task Board",
      "status": "verified",
      "observation": "exact postcondition present"
    }
  ],
  "blocker": null,
  "semantic_outcome": "M02 contract complete"
}
